{
  "$schema": "https://corporate-ops-cv.dev/schema/v1",
  "version": "1.0.0",
  "locale": "vi",
  "personal": {
    "fullName": "Họ và Tên",
    "jobTitle": "Quản lý Vận hành | IT & Vận hành Doanh nghiệp",
    "avatar": "/avatar-placeholder.svg",
    "contact": {
      "email": "email@congty.com",
      "phone": "+84 000 000 0000",
      "linkedin": "linkedin.com/in/ho-so-cua-ban",
      "github": "github.com/ten-ban",
      "portfolio": "website-cua-ban.com",
      "location": "Thành phố, Việt Nam"
    }
  },
  "summary": "Tóm tắt chuyên môn ngắn gọn, theo phong cách corporate, nhấn kinh nghiệm, thế mạnh và định hướng nghề nghiệp (tối thiểu 120 ký tự).",
  "experience": [],
  "skills": {
    "technical": [],
    "soft": [],
    "tools": [],
    "infrastructure": [],
    "management": []
  },
  "education": [],
  "certifications": [],
  "projects": [],
  "languages": []
}
